### ISSUE TITLE
err: http: ContentLength=12 with Body length 0"

### ISSUE THREAD

**Issue by pengshengguo** [vulcand/oxy#86]
time="2017-08-04T15:34:29+08:00" level=error msg="vulcand/oxy/forward/httpbuffer: Error forwarding to http://172.32.148.24, err: http: ContentLength=12 with Body length 0"

**Comment by pengshengguo** [comment]
Frame 66: 434 bytes on wire (3472 bits), 434 bytes captured (3472 bits) on interface 0
Ethernet II, Src: IntelCor_5e:c0:00 (24:77:03:5e:c0:00), Dst: Tp-LinkT_5e:40:39 (3c:46:d8:5e:40:39)
Internet Protocol Version 4, Src: 192.168.1.105, Dst: 172.32.148.24
Transmission Control Protocol, Src Port: 62244, Dst Port: 80, Seq: 1, Ack: 1, Len: 380
Hypertext Transfer Protocol
    POST /api/review-requests/ HTTP/1.1\r\n
    Cookie: rbsessionid=ad4556edbecf6fff19a56050e2e6e811\r\n
    Content-Length: 12\r\n
    Content-Type: application/x-www-form-urlencoded; charset=UTF-8\r\n
    Host: 172.32.148.24\r\n
    Connection: Keep-Alive\r\n
    User-Agent: Apache-HttpClient/4.4.1 (Java/1.8.0_76-release)\r\n
    Cookie: rbsessionid=e15872090dd3d64f9da6e85c7f4434c1\r\n
    Accept-Encoding: gzip,deflate\r\n
    \r\n
    [Full request URI: http://172.32.148.24/api/review-requests/]
    [HTTP request 1/1]
    [Response in frame: 69]
    File Data: 12 bytes
HTML Form URL Encoded: application/x-www-form-urlencoded

**Comment by pengshengguo** [comment]
When I send it directly, that's right. When I passed the agent, the above error occurred. Why??

**Comment by ldez** [comment]
closed due to age
